{
  "lesson_id": "farsi-02",
  "language": "farsi",
  "level": "beginner",
  "title": "The Poetic Heart - Beautiful Everyday Expressions",
  "description": "Discover the poetry woven into everyday Persian speech - phrases that reveal the dramatic, emotional soul of Farsi",
  "learning_objectives": [
    "Experience how Persians express emotions poetically in daily life",
    "Learn culturally significant phrases that carry deeper meaning",
    "Understand the dramatic flair inherent in Persian communication",
    "Recognize how poetry and everyday speech intertwine in Farsi"
  ],
  "phrases": [
    {
      "id": "farsi-02-001",
      "native": "قربان شما",
      "transliteration": "ghorbane shoma",
      "translation": "I sacrifice myself for you (term of endearment)",
      "literal_translation": "sacrifice-of you",
      "audio_file": "audio/farsi-02-001-ghorbane-shoma.mp3",
      "frequency_rank": 12,
      "formality": "informal",
      "usage_context": [
        "Expressing affection",
        "Showing deep appreciation",
        "Used between close friends, family, or lovers",
        "Can be used playfully or seriously"
      ],
      "patterns": [
        "قربان (ghorban) = sacrifice",
        "Possessive construction: 'sacrifice of you'",
        "Hyperbolic expression of love/devotion"
      ],
      "cultural_notes": "THIS is the essence of Persian dramatic expression! Iranians don't just say 'thank you' or 'I appreciate you' - they say 'I would sacrifice myself for you.' It sounds extreme, but it's everyday speech. This reveals how Persians communicate with passion and poetry even in casual conversation.",
      "breakdown": [
        {
          "word": "قربان",
          "transliteration": "ghorbane",
          "meaning": "sacrifice (of)",
          "part_of_speech": "noun (possessive form)"
        },
        {
          "word": "شما",
          "transliteration": "shoma",
          "meaning": "you (formal)",
          "part_of_speech": "pronoun"
        }
      ],
      "parrot_method": {
        "repetitions_suggested": 15,
        "speed": "slow",
        "focus_sounds": [
          "ghor - guttural 'gh' from back of throat",
          "ba - short",
          "ne - connecting sound",
          "Say it with emotion - this isn't flat!"
        ]
      }
    },
    {
      "id": "farsi-02-002",
      "native": "جانم",
      "transliteration": "jaanam",
      "translation": "My dear / My soul",
      "literal_translation": "soul-my",
      "audio_file": "audio/farsi-02-002-jaanam.mp3",
      "frequency_rank": 9,
      "formality": "informal",
      "usage_context": [
        "Term of endearment",
        "Addressing loved ones",
        "Showing affection",
        "Also used when answering phone/door from close person"
      ],
      "patterns": [
        "جان (jaan) = soul/life",
        "م (am) = my",
        "Combined: 'my soul'"
      ],
      "cultural_notes": "Persians call their loved ones 'my soul' - not just 'honey' or 'sweetie.' Even parents addressing children say 'جانم' (jaanam). The language itself is built on poetry and intensity of feeling.",
      "breakdown": [
        {
          "word": "جانم",
          "transliteration": "jaanam",
          "meaning": "my soul/life",
          "part_of_speech": "noun + possessive suffix"
        }
      ],
      "parrot_method": {
        "repetitions_suggested": 12,
        "speed": "normal",
        "focus_sounds": [
          "jaa - long 'aa' sound",
          "nam - soft 'm' at end",
          "Practice with warmth in your voice"
        ]
      }
    },
    {
      "id": "farsi-02-003",
      "native": "دلم برات تنگ شده",
      "transliteration": "delam barat tang shode",
      "translation": "I miss you",
      "literal_translation": "heart-my for-you narrow has-become",
      "audio_file": "audio/farsi-02-003-delam-barat-tang-shode.mp3",
      "frequency_rank": 25,
      "formality": "informal",
      "usage_context": [
        "Expressing missing someone",
        "Emotional conversations",
        "Between friends, family, lovers"
      ],
      "patterns": [
        "دلم (delam) = my heart",
        "برات (barat) = for you",
        "تنگ (tang) = narrow/tight",
        "شده (shode) = has become"
      ],
      "cultural_notes": "THIS is pure Persian poetry! They don't say 'I miss you' - they say 'my heart has become narrow for you.' The imagery is that their heart feels constricted, tight, suffocated without you. Every phrase is a poem.",
      "breakdown": [
        {
          "word": "دلم",
          "transliteration": "delam",
          "meaning": "my heart",
          "part_of_speech": "noun + possessive"
        },
        {
          "word": "برات",
          "transliteration": "barat",
          "meaning": "for you",
          "part_of_speech": "preposition + pronoun"
        },
        {
          "word": "تنگ",
          "transliteration": "tang",
          "meaning": "narrow/tight",
          "part_of_speech": "adjective"
        },
        {
          "word": "شده",
          "transliteration": "shode",
          "meaning": "has become",
          "part_of_speech": "verb (past perfect)"
        }
      ],
      "parrot_method": {
        "repetitions_suggested": 18,
        "speed": "slow",
        "focus_sounds": [
          "del - like 'dell'",
          "am - my",
          "ba - short",
          "rat - rolled 'r' if possible",
          "Say it wistfully - let the emotion show!"
        ]
      }
    },
    {
      "id": "farsi-02-004",
      "native": "چشم",
      "transliteration": "cheshm",
      "translation": "Yes, of course / On my eyes (agreement with devotion)",
      "literal_translation": "eye",
      "audio_file": "audio/farsi-02-004-cheshm.mp3",
      "frequency_rank": 14,
      "formality": "informal",
      "usage_context": [
        "Enthusiastic agreement",
        "Accepting a request graciously",
        "Showing willingness to do something",
        "More emphatic than just 'yes'"
      ],
      "patterns": [
        "چشم (cheshm) = eye",
        "Implies 'on my eyes' - I'll do it with honor",
        "Shows devotion and eagerness"
      ],
      "cultural_notes": "When a Persian says 'چشم' (on my eyes), they're saying 'I'll do it so gladly, I'll place it on my eyes' - the most precious part of their body. Again, everyday speech is dramatic and poetic!",
      "breakdown": [
        {
          "word": "چشم",
          "transliteration": "cheshm",
          "meaning": "eye (implying 'on my eyes')",
          "part_of_speech": "noun (used as emphatic agreement)"
        }
      ],
      "parrot_method": {
        "repetitions_suggested": 10,
        "speed": "normal",
        "focus_sounds": [
          "che - like 'chess'",
          "shm - 'sh' then 'm' together",
          "Say it eagerly - this shows enthusiasm!"
        ]
      }
    },
    {
      "id": "farsi-02-005",
      "native": "دستت درد نکنه",
      "transliteration": "dastet dard nakone",
      "translation": "Thank you (may your hand not hurt)",
      "literal_translation": "hand-your pain not-do",
      "audio_file": "audio/farsi-02-005-dastet-dard-nakone.mp3",
      "frequency_rank": 18,
      "formality": "informal",
      "usage_context": [
        "Thanking someone for doing something",
        "After receiving food or a service",
        "Acknowledging someone's effort",
        "Warmer than standard 'thank you'"
      ],
      "patterns": [
        "دستت (dastet) = your hand",
        "درد نکنه (dard nakone) = may it not hurt",
        "Blessing/well-wishing form of thanks"
      ],
      "cultural_notes": "Persians thank you by blessing you: 'May your hand not hurt from the effort.' It acknowledges the work someone did and wishes them well. It's poetic gratitude.",
      "breakdown": [
        {
          "word": "دستت",
          "transliteration": "dastet",
          "meaning": "your hand",
          "part_of_speech": "noun + possessive"
        },
        {
          "word": "درد",
          "transliteration": "dard",
          "meaning": "pain",
          "part_of_speech": "noun"
        },
        {
          "word": "نکنه",
          "transliteration": "nakone",
          "meaning": "may it not do/cause",
          "part_of_speech": "verb (subjunctive negative)"
        }
      ],
      "parrot_method": {
        "repetitions_suggested": 14,
        "speed": "normal",
        "focus_sounds": [
          "das - like 'dust' but 'das'",
          "tet - your",
          "dard - rolled 'r'",
          "na-ko-ne - three distinct syllables"
        ]
      }
    },
    {
      "id": "farsi-02-006",
      "native": "قابلی نداره",
      "transliteration": "ghābeli nadāre",
      "translation": "It's nothing / Don't mention it",
      "literal_translation": "capability not-has",
      "audio_file": "audio/farsi-02-006-ghabeli-nadare.mp3",
      "frequency_rank": 20,
      "formality": "informal",
      "usage_context": [
        "Response to thanks",
        "Downplaying one's effort humbly",
        "After doing a favor"
      ],
      "patterns": [
        "قابل (ghābel) = worthy/capable",
        "ی (-i) makes it 'a capability'",
        "نداره (nadāre) = doesn't have"
      ],
      "cultural_notes": "Persian humility: 'It's not even worthy of mention.' Even when someone worked hard for you, they'll minimize it - this is Persian ta'arof (ritual politeness).",
      "breakdown": [
        {
          "word": "قابلی",
          "transliteration": "ghābeli",
          "meaning": "a capability/worthiness",
          "part_of_speech": "noun"
        },
        {
          "word": "نداره",
          "transliteration": "nadāre",
          "meaning": "doesn't have",
          "part_of_speech": "verb (negative present)"
        }
      ],
      "parrot_method": {
        "repetitions_suggested": 12,
        "speed": "normal",
        "focus_sounds": [
          "ghā - guttural",
          "be-li - two syllables",